[
  {"id":"rule-001","clientId":"client-001","name":"Уведомление о новых задачах","description":"Уведомлять при назначении новой задачи","triggerType":"event","triggerEvent":"task.assigned","conditions":[{"field":"priority","operator":"in","value":["high","urgent"]}],"targetRoles":["assignee"],"channels":["inbox","email","push"],"templateId":"tpl-001","priority":"high","category":"task","status":"active","escalateAfterMinutes":60,"escalateTo":"manager","bundleInDigest":false,"cooldownMinutes":null,"maxPerDay":null,"firedCount":156,"lastFiredAt":"2025-03-20T09:00:00Z","createdByUserId":"user-001","createdByName":"Maria Admin","createdAt":"2025-01-01T00:00:00Z","updatedAt":"2025-03-20T09:00:00Z"},
  {"id":"rule-002","clientId":"client-001","name":"Запросы на одобрение","description":"Уведомлять о новых запросах на одобрение","triggerType":"event","triggerEvent":"approval.requested","conditions":[],"targetRoles":["approver"],"channels":["inbox","email"],"templateId":"tpl-002","priority":"high","category":"approval","status":"active","escalateAfterMinutes":240,"escalateTo":"admin","bundleInDigest":false,"firedCount":89,"lastFiredAt":"2025-03-20T11:00:00Z","createdByUserId":"user-001","createdByName":"Maria Admin","createdAt":"2025-01-01T00:00:00Z","updatedAt":"2025-03-20T11:00:00Z"},
  {"id":"rule-003","clientId":"client-001","name":"Обновления документов","description":"Уведомлять об изменениях в отслеживаемых документах","triggerType":"event","triggerEvent":"document.updated","conditions":[{"field":"isWatched","operator":"eq","value":true}],"targetRoles":["watcher"],"channels":["inbox"],"templateId":"tpl-003","priority":"normal","category":"alert","status":"active","bundleInDigest":true,"digestFrequency":"daily","firedCount":342,"lastFiredAt":"2025-03-19T14:00:00Z","createdByUserId":"user-001","createdByName":"Maria Admin","createdAt":"2025-01-01T00:00:00Z","updatedAt":"2025-03-19T14:00:00Z"},
  {"id":"rule-004","clientId":"client-001","name":"Напоминания о дедлайнах","description":"Напоминать о приближающихся дедлайнах за 1 день","triggerType":"schedule","triggerSchedule":"0 8 * * *","conditions":[{"field":"dueDate","operator":"lte","value":"{{tomorrow}}"}],"targetRoles":["assignee"],"channels":["inbox","push"],"templateId":"tpl-004","priority":"high","category":"reminder","status":"active","firedCount":78,"lastFiredAt":"2025-03-20T08:00:00Z","createdByUserId":"user-001","createdByName":"Maria Admin","createdAt":"2025-01-01T00:00:00Z","updatedAt":"2025-03-20T08:00:00Z"},
  {"id":"rule-005","clientId":"client-001","name":"Готовность отчётов","description":"Уведомлять о готовых отчётах","triggerType":"event","triggerEvent":"report.ready","conditions":[],"targetRoles":["requester"],"channels":["inbox","email"],"templateId":"tpl-005","priority":"normal","category":"report","status":"active","bundleInDigest":false,"firedCount":234,"lastFiredAt":"2025-03-20T12:00:00Z","createdByUserId":"user-002","createdByName":"Tom RM","createdAt":"2025-01-15T00:00:00Z","updatedAt":"2025-03-20T12:00:00Z"},
  {"id":"rule-006","clientId":"client-001","name":"Сообщения от клиентов","description":"Уведомлять о новых сообщениях от клиентов","triggerType":"event","triggerEvent":"message.received","conditions":[{"field":"senderType","operator":"eq","value":"client"}],"targetRoles":["rm","advisor"],"channels":["inbox","push","slack"],"templateId":"tpl-006","priority":"normal","category":"message","status":"active","firedCount":567,"lastFiredAt":"2025-03-20T10:45:00Z","createdByUserId":"user-001","createdByName":"Maria Admin","createdAt":"2025-01-01T00:00:00Z","updatedAt":"2025-03-20T10:45:00Z"},
  {"id":"rule-007","clientId":"client-001","name":"Критические оповещения","description":"Срочные уведомления о критических событиях","triggerType":"event","triggerEvent":"alert.critical","conditions":[],"targetRoles":["admin","manager"],"channels":["inbox","email","sms","push"],"templateId":"tpl-007","priority":"urgent","category":"alert","status":"active","escalateAfterMinutes":15,"escalateTo":"superadmin","firedCount":12,"lastFiredAt":"2025-03-15T03:22:00Z","createdByUserId":"user-001","createdByName":"Maria Admin","createdAt":"2025-01-01T00:00:00Z","updatedAt":"2025-03-15T03:22:00Z"},
  {"id":"rule-008","clientId":"client-001","name":"Нарушения комплаенс","description":"Уведомлять о нарушениях политик","triggerType":"event","triggerEvent":"compliance.violation","conditions":[],"targetRoles":["compliance","admin"],"channels":["inbox","email"],"templateId":"tpl-008","priority":"urgent","category":"compliance","status":"active","escalateAfterMinutes":30,"escalateTo":"cco","firedCount":23,"lastFiredAt":"2025-03-20T08:15:00Z","createdByUserId":"user-003","createdByName":"Lisa Compliance","createdAt":"2025-01-01T00:00:00Z","updatedAt":"2025-03-20T08:15:00Z"}
]
